{
  "manifest_version": "1.0.0",
  "as_of_date": "2026-09-18",
  "provenance_vocabulary": [
    "observed",
    "measured",
    "derived",
    "matched",
    "generated",
    "human_labeled",
    "simulated"
  ],
  "sources": [
    {
      "id": "uci_mec_execution_times_859",
      "title": "Image Recognition Task Execution Times in Mobile Edge Computing",
      "role": "Measured turnaround-time calibration for heterogeneous edge servers",
      "official_url": "https://archive.ics.uci.edu/dataset/859/image+recognition+task+execution+times+in+mobile+edge+computing",
      "citation_url": "https://doi.org/10.24432/C5N617",
      "version": "DOI 10.24432/C5N617; donated 2023-08-14",
      "version_kind": "doi",
      "immutable_version": true,
      "access_status": "public",
      "dataset_status": "schema_validated",
      "license": {
        "identifier": "CC-BY-4.0",
        "verification_status": "verified",
        "usage_scope": "attribution",
        "redistribution_allowed": true,
        "evidence_url": "https://archive.ics.uci.edu/dataset/859/image+recognition+task+execution+times+in+mobile+edge+computing",
        "notes": "UCI page reports 4000 sequential measurements and CC BY 4.0."
      },
      "artifacts": [
        {
          "artifact_id": "tat_description_zip",
          "filename": "TATDescriptionDataset.zip",
          "size_bytes": 80831,
          "checksum": {
            "algorithm": "sha256",
            "value": "23716d6985bdcf24c74b9c8f0d8887bbcb56a110796af78a0778e30f08628527",
            "verification": "verified"
          }
        }
      ],
      "columns": [
        {
          "name": "event_time",
          "description": "Timestamp recorded for the execution observation",
          "unit": "ISO-8601 datetime",
          "provenance": "observed",
          "source_fields": ["Time"],
          "transform": "parse source timestamp without random shuffling",
          "nullable": false
        },
        {
          "name": "turnaround_time_s",
          "description": "Measured send-to-result turnaround time",
          "unit": "s",
          "provenance": "measured",
          "source_fields": ["Execution Time"],
          "transform": "coerce to finite positive seconds",
          "nullable": false
        },
        {
          "name": "edge_server_id",
          "description": "One of the four heterogeneous measured servers",
          "unit": null,
          "provenance": "derived",
          "source_fields": ["source filename"],
          "transform": "map documented server file to immutable server identifier",
          "nullable": false
        }
      ],
      "raw_data_committed_to_git": false,
      "notes": "Downloaded and schema-validated on 2026-09-18. The outer ZIP contains one nested ZIP; four CSV files each contain 1000 positive turnaround-time measurements. The source timestamps have no timezone and are retained as source-local naive datetimes."
    },
    {
      "id": "eua_dataset",
      "title": "EUA Datasets",
      "role": "Real-world-derived Australian user and edge-server locations",
      "official_url": "https://github.com/PhuLai/eua-dataset",
      "citation_url": "https://github.com/PhuLai/eua-dataset#dataset-citation",
      "version": "git commit 61238e00a6f01019c8a6ba1619675337a879a3d4",
      "version_kind": "git_commit",
      "immutable_version": true,
      "access_status": "public",
      "dataset_status": "schema_validated",
      "license": {
        "identifier": "MIT",
        "verification_status": "verified",
        "usage_scope": "repository_license",
        "redistribution_allowed": true,
        "evidence_url": "https://github.com/PhuLai/eua-dataset/blob/master/LICENSE",
        "notes": "Repository is MIT licensed; upstream ACMA/IP geolocation acknowledgements remain attributable."
      },
      "artifacts": [
        {
          "artifact_id": "eua_git_snapshot",
          "filename": "eua-dataset-61238e00a6f01019c8a6ba1619675337a879a3d4.zip",
          "size_bytes": 34008830,
          "checksum": {
            "algorithm": "sha256",
            "value": "22c07483de496358988275e2b59f4808a49db7dd8469122809e544b197fd8b72",
            "verification": "verified"
          }
        }
      ],
      "columns": [
        {
          "name": "source_entity_id",
          "description": "Stable identifier derived from the immutable member path and row number",
          "unit": null,
          "provenance": "derived",
          "source_fields": ["source file", "row index"],
          "transform": "SHA-256 of immutable source member path and original row number",
          "nullable": false
        },
        {
          "name": "latitude_deg",
          "description": "Latitude supplied by the EUA dataset",
          "unit": "degree",
          "provenance": "observed",
          "source_fields": ["latitude"],
          "transform": null,
          "nullable": false
        },
        {
          "name": "longitude_deg",
          "description": "Longitude supplied by the EUA dataset",
          "unit": "degree",
          "provenance": "observed",
          "source_fields": ["longitude"],
          "transform": null,
          "nullable": false
        },
        {
          "name": "entity_kind",
          "description": "User or edge-server role from source folder",
          "unit": null,
          "provenance": "derived",
          "source_fields": ["users/ or edge-servers/ path"],
          "transform": "map source folder to user or edge_server",
          "nullable": false
        }
      ],
      "raw_data_committed_to_git": false,
      "notes": "Commit-pinned snapshot downloaded and selected schemas validated on 2026-09-18. The privacy-minimum adapter uses site.csv and users-aus.csv coordinates only, derives IDs from source path/row, and discards raw IP, site name, postcode and administrative metadata. Generated user files and HTML maps are not used in the core benchmark."
    },
    {
      "id": "bupt_edge_computing_dataset",
      "title": "BUPT Edge Computing Dataset",
      "role": "Mobile session arrivals, traffic volumes, cell transitions, RAT and service metadata",
      "official_url": "https://github.com/BuptMecMigration/Edge-Computing-Dataset",
      "citation_url": "https://doi.org/10.1109/JIOT.2022.3176631",
      "version": "git commit 04e664fab9cdb2a58d04ebc615cd74405e6062e2",
      "version_kind": "git_commit",
      "immutable_version": true,
      "access_status": "public",
      "dataset_status": "schema_validated",
      "license": {
        "identifier": "LicenseRef-BUPT-Public-Research-Statement",
        "verification_status": "verified",
        "usage_scope": "research_only",
        "redistribution_allowed": false,
        "evidence_url": "https://github.com/BuptMecMigration/Edge-Computing-Dataset/blob/04e664fab9cdb2a58d04ebc615cd74405e6062e2/README.MD",
        "notes": "The pinned README states that the ISP dataset is publicly released for Edge Computing research and requests citation of Liu, Li and Wang (IEEE IoT Journal, 2022). No general redistribution license is present, so this project conservatively permits only local non-commercial thesis research and forbids raw/derived-row redistribution. Written clarification remains desirable but is not an analysis gate under this policy."
      },
      "artifacts": [
        {
          "artifact_id": "bupt_data_snapshot",
          "filename": "Edge-Computing-Dataset-04e664fab9cdb2a58d04ebc615cd74405e6062e2.zip",
          "size_bytes": 28964429,
          "checksum": {
            "algorithm": "sha256",
            "value": "5d89bd853a5300207892dad38070957b935a95ea02bfe1ec063e0c4829e21822",
            "verification": "verified"
          }
        }
      ],
      "columns": [
        {
          "name": "device_id",
          "description": "Privacy-processed mobile subscriber identifier",
          "unit": null,
          "provenance": "observed",
          "source_fields": ["Phone Number"],
          "transform": "project-local keyed HMAC-SHA256 before processed storage",
          "nullable": false
        },
        {
          "name": "station_id",
          "description": "Cell identity formed from location area and cell codes",
          "unit": null,
          "provenance": "derived",
          "source_fields": ["Location Area Code(LAC)", "Cell Identity(CI)"],
          "transform": "concatenate canonical LAC and CI",
          "nullable": false
        },
        {
          "name": "arrival_time",
          "description": "Mobile network session start time",
          "unit": "ISO-8601 datetime",
          "provenance": "observed",
          "source_fields": ["Start Time", "source filename date"],
          "transform": "parse headerless positional field 8; retain source-local time semantics and filename date",
          "nullable": false
        },
        {
          "name": "input_bits",
          "description": "Uplink traffic converted from source bytes",
          "unit": "bit",
          "provenance": "derived",
          "source_fields": ["Uplink traffic"],
          "transform": "bytes * 8",
          "nullable": false
        },
        {
          "name": "output_bits",
          "description": "Downlink traffic converted from source bytes",
          "unit": "bit",
          "provenance": "derived",
          "source_fields": ["Downlink traffic"],
          "transform": "bytes * 8",
          "nullable": false
        },
        {
          "name": "application_id",
          "description": "Service family derived from privacy-safe protocol metadata",
          "unit": null,
          "provenance": "derived",
          "source_fields": ["URL", "Destination Port", "Content-Type"],
          "transform": "documented deterministic categorizer using privacy-safe metadata only; raw URLs, IPs and user agents never enter the LLM corpus",
          "nullable": true
        }
      ],
      "raw_data_committed_to_git": false,